{
  "id": "ms-teams-meeting-zh",
  "sourceTextHash": "a0f94c9a2c2efb234a1dc48df14b86eca5d4b916bc6c4de3200c2949029325d0",
  "targetLang": "zh",
  "translatedText": "[Mock 简体中文] Microsoft Teams Meetings is a video-conferencing software developed by Microsoft. Video meetings integrated with Microsoft Teams chat and files.",
  "translatorModel": "agnes-2.0-flash-mock",
  "confidenceScore": 0.9,
  "reviewStatus": "pending",
  "metadata": {
    "created": "2026-07-19",
    "sourceLang": "en",
    "softwareId": "ms-teams-meeting"
  },
  "_meta": {
    "source": "ai-generated-mock",
    "schema_version": "1.0.0",
    "unverified_fields": [
      "translatedText"
    ],
    "confidence": "medium"
  }
}