{
  "id": "gitlab-enterprise-it",
  "sourceTextHash": "dfb38719abb1c868a8d71ff4f759ca1519de28df681b4b5d6cb9d5ef51472c52",
  "targetLang": "it",
  "translatedText": "[Mock Italiano] GitLab Enterprise is a development-tools software developed by GitLab. Enterprise Git platform with security, compliance, and analytics.",
  "translatorModel": "agnes-2.0-flash-mock",
  "confidenceScore": 0.9,
  "reviewStatus": "pending",
  "metadata": {
    "created": "2026-07-19",
    "sourceLang": "en",
    "softwareId": "gitlab-enterprise"
  },
  "_meta": {
    "source": "ai-generated-mock",
    "schema_version": "1.0.0",
    "unverified_fields": [
      "translatedText"
    ],
    "confidence": "medium"
  }
}