{
  "id": "bettertouchtool-vi",
  "sourceTextHash": "84ef40c96dca524a70c4c7df151f082cbf06de67df4d0b37cd30ebb7d7bf6ffb",
  "targetLang": "vi",
  "translatedText": "[Mock Tiếng Việt] BetterTouchTool is a system-utilities software developed by Folivora. Mac customization tool for gestures and shortcuts.",
  "translatorModel": "agnes-2.0-flash-mock",
  "confidenceScore": 0.9,
  "reviewStatus": "pending",
  "metadata": {
    "created": "2026-07-19",
    "sourceLang": "en",
    "softwareId": "bettertouchtool"
  },
  "_meta": {
    "source": "ai-generated-mock",
    "schema_version": "1.0.0",
    "unverified_fields": [
      "translatedText"
    ],
    "confidence": "medium"
  }
}