{
  "id": "keeper-password-manager-fr",
  "sourceTextHash": "d7b4e233e5459a099621b839409fd0db8597b555fb6a9f92f24331b6740549c7",
  "targetLang": "fr",
  "translatedText": "[Mock Français] Keeper Password Manager is a security-software software developed by Keeper Security. Zero-knowledge password manager with breach monitoring.",
  "translatorModel": "agnes-2.0-flash-mock",
  "confidenceScore": 0.9,
  "reviewStatus": "pending",
  "metadata": {
    "created": "2026-07-19",
    "sourceLang": "en",
    "softwareId": "keeper-password-manager"
  },
  "_meta": {
    "source": "ai-generated-mock",
    "schema_version": "1.0.0",
    "unverified_fields": [
      "translatedText"
    ],
    "confidence": "medium"
  }
}