{
  "id": "zeplin-pt",
  "sourceTextHash": "8d68c7acd0f0653718a6b494991ba7e08352317e6b312e6436af2f15698e30e9",
  "targetLang": "pt",
  "translatedText": "[Mock Português] Zeplin is a design-collaboration software developed by Zeplin. Design handoff platform for sharing specs with developers.",
  "translatorModel": "agnes-2.0-flash-mock",
  "confidenceScore": 0.9,
  "reviewStatus": "pending",
  "metadata": {
    "created": "2026-07-19",
    "sourceLang": "en",
    "softwareId": "zeplin"
  },
  "_meta": {
    "source": "ai-generated-mock",
    "schema_version": "1.0.0",
    "unverified_fields": [
      "translatedText"
    ],
    "confidence": "medium"
  }
}