{
  "id": "corel-painter-zh",
  "sourceTextHash": "00e26279043adec9786721f45dbf5bc7b31c9f673c3effc994e8622fbde30869",
  "targetLang": "zh",
  "translatedText": "[Mock 简体中文] Corel Painter is a image-editing software developed by Corel. Digital art and painting software with natural-media brushes.",
  "translatorModel": "agnes-2.0-flash-mock",
  "confidenceScore": 0.9,
  "reviewStatus": "pending",
  "metadata": {
    "created": "2026-07-19",
    "sourceLang": "en",
    "softwareId": "corel-painter"
  },
  "_meta": {
    "source": "ai-generated-mock",
    "schema_version": "1.0.0",
    "unverified_fields": [
      "translatedText"
    ],
    "confidence": "medium"
  }
}