{
  "id": "acorn-hi",
  "sourceTextHash": "f94a7e8e4b4d7763eb10e628e7212e336c523a05bfbfabe2fb83750d848c9086",
  "targetLang": "hi",
  "translatedText": "[Mock हिन्दी] Acorn is a image-editing software developed by Flying Meat. Mac photo editor built for speed with curves and layers.",
  "translatorModel": "agnes-2.0-flash-mock",
  "confidenceScore": 0.9,
  "reviewStatus": "pending",
  "metadata": {
    "created": "2026-07-19",
    "sourceLang": "en",
    "softwareId": "acorn"
  },
  "_meta": {
    "source": "ai-generated-mock",
    "schema_version": "1.0.0",
    "unverified_fields": [
      "translatedText"
    ],
    "confidence": "medium"
  }
}