{
  "id": "zoom-rooms-ko",
  "sourceTextHash": "e7c3673dc2eb7e3568182f1202011010ed76a909979e6be044343dfe4a7397bb",
  "targetLang": "ko",
  "translatedText": "[Mock 한국어] Zoom Rooms is a video-conferencing software developed by Zoom. Conference room solution for video meetings with hardware.",
  "translatorModel": "agnes-2.0-flash-mock",
  "confidenceScore": 0.9,
  "reviewStatus": "pending",
  "metadata": {
    "created": "2026-07-19",
    "sourceLang": "en",
    "softwareId": "zoom-rooms"
  },
  "_meta": {
    "source": "ai-generated-mock",
    "schema_version": "1.0.0",
    "unverified_fields": [
      "translatedText"
    ],
    "confidence": "medium"
  }
}