{
  "id": "cacoo-ms",
  "sourceTextHash": "fa657b7bc8966feab95c8e25019b8aa5d58ebe98d1980821028fc9871035ddb5",
  "targetLang": "ms",
  "translatedText": "[Mock Bahasa Melayu] Cacoo is a design-collaboration software developed by Nulab. Cloud-based diagramming and wireframing tool.",
  "translatorModel": "agnes-2.0-flash-mock",
  "confidenceScore": 0.9,
  "reviewStatus": "pending",
  "metadata": {
    "created": "2026-07-19",
    "sourceLang": "en",
    "softwareId": "cacoo"
  },
  "_meta": {
    "source": "ai-generated-mock",
    "schema_version": "1.0.0",
    "unverified_fields": [
      "translatedText"
    ],
    "confidence": "medium"
  }
}