{
  "id": "ringcentral-video-th",
  "sourceTextHash": "93c18e832a031cb37cb151d3b1b8ba8e4a265aeb1f7a85c8f1b88b2793ea83cb",
  "targetLang": "th",
  "translatedText": "[Mock ไทย] RingCentral Video is a video-conferencing software developed by RingCentral. Video conferencing with team chat and whiteboard collaboration.",
  "translatorModel": "agnes-2.0-flash-mock",
  "confidenceScore": 0.9,
  "reviewStatus": "pending",
  "metadata": {
    "created": "2026-07-19",
    "sourceLang": "en",
    "softwareId": "ringcentral-video"
  },
  "_meta": {
    "source": "ai-generated-mock",
    "schema_version": "1.0.0",
    "unverified_fields": [
      "translatedText"
    ],
    "confidence": "medium"
  }
}