{
  "id": "raindrop-io-ms",
  "sourceTextHash": "fdc32c9303c581575e3d9dbc12250f81e441809fd9854da57bddc88d26727a78",
  "targetLang": "ms",
  "translatedText": "[Mock Bahasa Melayu] Raindrop.io is a note-taking software developed by Raindrop. Modern bookmark manager with collections, tags, and previews.",
  "translatorModel": "agnes-2.0-flash-mock",
  "confidenceScore": 0.9,
  "reviewStatus": "pending",
  "metadata": {
    "created": "2026-07-19",
    "sourceLang": "en",
    "softwareId": "raindrop-io"
  },
  "_meta": {
    "source": "ai-generated-mock",
    "schema_version": "1.0.0",
    "unverified_fields": [
      "translatedText"
    ],
    "confidence": "medium"
  }
}